{
  "schemaVersion": "1.0.0",
  "consumerProjectId": "projects/example-project",
  "consumerOntologyId": "consumer:example-project",
  "consumerOntologyVersion": "2.1.0",
  "successorVersion": "0.1.0",
  "bindingScope": "read",
  "boundAt": "2026-07-18T08:00:00Z",
  "byWhom": {
    "identity": "agent:claude-sonnet-5",
    "role": "worker"
  }
}
